image_id,post_caption,#_comments,#_likes,image_labels
371,pink | new woman editorial. now available online and in-stores #collection thank you @waleskagorczevski,171,55500,clothing pink fashion model neck pattern shoe sleeve peach leggings fashion design
372,join life sustainable collection. the refibra_lyocell is a new fiber created from recycled cotton and wood from sustainably managed forests #collection,175,85600,human hair color beauty blond model chin long hair supermodel forehead fashion model hair coloring
373,"join life sustainable collection | in the classic recycling, waste is shredded and blended with pure fibers to create new fabrics #collection",272,91600,shoulder neck orange joint sleeve arm active undergarment peach
374,join life collectionseason sumer 17 | new editorial. the combination of upcycled materials with more sustainable raw materials such as tencelîlyocell and ecologically grown cotton help us to reduce our impact and to take care of the environment. thank you @jean_campbell #collection,179,61500,shoulder neck fashion model sleeve joint supermodel waist active undergarment photo shoot beige
375,new editorialcollection | poplin #editorials #zaracollection now online and in-stores. thank you @matteomontanariphotography,540,121500,clothing fashion model shoulder denim jeans joint fashion waist electric blue long hair
377,new editorialcollection | poplin #editorials #zaracollection thank you @lucan_gillespie @matteomontanariphotography,147,78700,black and white monochrome photography photography fashion monochrome stock photography fashion design shoe
378,baby girl |season collection #collection #season,174,70700,product design angle triangle
379,baby boy |season collection #collection #season,118,60100,product design furniture triangle angle
380,baby girl |season collection #collection #season,555,121600,shoulder joint fashion accessory arm neck girl shoe vision care
381,stripedclothings | the off-shoulder ref 0594/056 #collection,294,86000,clothing fashion model shoulder fashion jeans sleeve waist trunk joint pattern
382,stripedclothings | the oversize ref 4786/050 #collection,516,53800,clothing sleeve fashion model outerwear shirt dress shirt neck pattern blouse
383,stripedclothings | the crossover ref 0594/051 #collection,176,48800,clothing standing denim jeans fashion model outerwear costume sleeve trousers neck
384,"this is #collection | round neck t-clothing with long, sheer sleeves ref 1165/032",231,60400,footwear shoulder fashion model shoe model joint leg photo shoot supermodel neck
385,this is #collection | cashmere sweater ref: 3887/003 and oversize t-clothing ref 7568/036,90,42500,shoulder neck photo shoot
386,this is #collection | high rise leggins with zip ref 7149/063,121,48500,clothing shoulder fashion model neck fashion sleeve leggings fashion design trousers
387,season season 2017 campaign by @matteomontanariphotography #seasonseason #collection,119,64400,photograph black black and white photography monochrome photography model photo shoot gentleman jacket human
388,season season 2017 campaign by @matteomontanariphotography #seasonseason #collection,372,122800,shoulder shoe sitting girl joint pattern beige
389,season season 2017 campaign by @matteomontanariphotography #seasonseason #collection,112,82800,photograph woman black black and white monochrome photography beauty photography photo shoot shoulder snapshot
390,season season 2017 man campaign by @willyvanderperre | exciting territories #seasonseason #collection,191,49500,fashion model model black and white gentleman photography standing fashion outerwear photo shoot coat
392,season season 2017 man campaign by @willyvanderperre | exciting territories #seasonseason #collection,110,55100,standing gentleman black and white outerwear fashion model coat joint monochrome photography monochrome uniform
393,season season 2017 campaign by steven meisel | thank you @fabienbaron #seasonseason,127,65400,photograph beauty black and white eyebrow monochrome photography model photography photo shoot eye black hair
395,season season 2017 campaign by steven meisel | full campaign at zara.com thank you @fabienbaron #collection #seasonseason,176,69600,fashion model black and white monochrome photography joint shoulder model fashion photography gentleman photo shoot
397,coming soon |season campaign | january 26 #comingsoon #season,301,44000,text black font logo line product area black and white brand product design
399,neutral territory | limited edition now available online and in selected stores #collection #collection,281,80400,photograph black and white monochrome photography photography beauty shoulder photo shoot sleeve outerwear portrait
401,soft collection | now available online and in selected stores #softcollection #collection,223,108500,clothing tartan plaid outerwear pattern sleeve design product neck pattern
402,white leather effectclothing with side zipped pockets | this is #collection ref 3046/032,215,85100,fashion model gentleman outerwear black and white coat photo shoot formal wear model long hair fashion design
403,this #collection | sweatclothing with lace up detail now available ref 5643/020,334,109600,white clothing shoulder sleeve outerwear joint black and white t shirt neck pattern
404,it's friday with @polyapolina_o #itsfridaywith,306,76700,cap knit cap headgear beanie hat woolen bonnet sun hat
408,hello from @pashaharu,325,92000,black and white monochrome photography photography gentleman monochrome black hair portrait photo shoot neck
409,this is #collection | short studio floral clothing with frills now available in-stores and zara.com ref 8529/858,480,93500,fashion model clothing dress day dress shoulder fashion model cocktail dress neck girl
410,wrap up warm! soft knit scarf ref 6771/201 #collection,509,136500,clothing woolen outerwear sleeve scarf neck sweater stole wool girl
412,this is #collection | faux fur collar bikerclothing 2969/269,590,74900,coat jacket fashion model fashion outerwear textile model fur clothing leather jacket fur
415,hello monday! oversized floralclothing ref 7521/042 #collection,822,149200,outerwear flower sleeve vision care neck top brown hair product girl
416,hello from @pavlovalia,237,63700,face portrait eyebrow beauty girl drawing forehead cheek design long hair
419,this is #collection | floral embroidered oversized sweater ref 9598/130,"1,233",151200,clothing sweater woolen outerwear sleeve neck poncho wool pattern blouse
420,disco forest collection now available online and in-stores #collection #discoforest,161,38400,purple girl fun performance computer wallpaper happiness event pop music
425,it_s cold outside | short contrastclothing ref 2969/042 #collection,273,64900,fur clothing fashion model fur beauty eyebrow fashion cheek textile lip supermodel
426,clothing up | newseasonseason editorial #collection #editorials,203,63500,footwear jacket outerwear jeans gentleman fashion boy sweater shoe cool
427,clothing up | newseasonseason editorial. thank you @theoneilson and @tdibble13 #collection #editorials,127,60900,black photograph person black and white beauty photography monochrome photography gentleman male outerwear
428,clothing up | newseasonseason editorial. thank you @tdibble13 #collection #editorials,183,52700,coat overcoat outerwear fashion woolen fashion model jacket gentleman sweater
429,theclothing edit | now available online and in-stores #editorials #collection,358,104200,fur clothing fur girl coat outerwear textile jeans material long hair fun
430,theclothing edit | _feel warmth in the simple things_ #editorials #collection,257,88700,coat fashion model fashion fashion show suit outerwear overcoat runway socialite blazer
431,theclothing edit | _wrap up in yourseason clothes_ thank you @sashapivovarovareal #collection #editorials,189,93000,clothing black black and white coat standing photography outerwear fashion shoulder monochrome photography
432,hello from @estellabrons and @elizabethdavison,252,74800,face facial expression black and white portrait nose beauty head shoulder emotion drawing
434,kids december editorial | chapter 2 with @maria_lang #collection #editorials,242,96700,string instrument sitting guitar plucked string instruments product musical instrument musician music girl fun
435,kids december editorial | chapter #2 thank you @maria_lang #collection #editorials,159,113800,snow winter mountainous landforms wilderness tree ridge mountain mountain range sky geological phenomenon
436,this is #collection | short oversized #sweatclothing ref 7568/820 #clothing ref 3564/162 boyfriend #clothing ref 6840/275 #clothing ref 1740/201,446,112800,clothing hood hoodie outerwear fashion model coat jacket sleeve neck
437,happy monday! sweater with snap button sleeves ref 2655/120 and leather clothing ref 5479/082 #collection,446,150000,fashion model shoulder sleeve fashion model neck supermodel socialite formal wear long hair
438,pretty in punk | newcollection editorial. _it_s about being rebellious and thinking out of the box_ #editorials #zaracollection,285,109600,fashion shoulder girl outerwear sitting shoe socialite fun long hair photo shoot
439,pretty in punk | newcollection editorial. now available online and in-stores. thank you @laurijnbijnen and @marjanjonkman and #editorials #zaracollection,187,87000,white black photograph black and white beauty girl photography snapshot monochrome photography fashion
440,"pretty in punk | newcollection editorial. _punk for me means going against the grain, doing the unusual and getting out of my comfort zone_ thank you @laurijnbijnen #editorials #zaracollection",181,68100,footwear fashion model shoe fashion shoulder supermodel leg photo shoot long hair joint
441,kids december editorial | chapter #1 with @monikalenarczyk #collection #editorials,565,199400,photograph child girl mother happiness joint photo shoot trunk infant smile
442,kids december editorial | chapter #1 thank you @monikalenarczyk #collection #editorials,344,184000,fun girl interaction happiness computer wallpaper romance
445,hello from @helenaseverin #itsfriday,312,85200,human hair color hairstyle shoulder long hair bangs fashion model black hair girl brown hair hair coloring
446,woman studio capsule collection | edit 2. now available online and selected stores #collection,230,90900,fashion model denim jeans fashion dress girl socialite photo shoot shoe model
447,woman studio capsule collection | edit 2. now available online and selected stores #collection thank you @roosabels,264,111700,dress girl sky photo shoot vacation sand summer landscape beach model
448,#comingsoon woman studio capsule collection | edit 2. available november 10th online and selected stores. #collection,149,99600,black black and white shoulder beauty neck standing monochrome photography photography joint model
449,#comingsoon woman studio capsule collection | edit 2. available november 10th online and selected stores. #collection,185,86900,shoulder neck arm joint active undergarment product thigh
450,#comingsoon woman studio capsule collection | edit 2. available november 10th online and selected stores. #collection,232,97100,neck joint shoulder active undergarment arm temporary tattoo back waist muscle sleeve
452,man evening editorial | explore full collection online and in-stores #collection #editorials,316,89700,fashion model shoulder outerwear fashion model joint neck sleeve pattern jeans
454,#comingsoon woman studio capsule collection | edit 2. available november 10th online and selected stores. #collection,329,126200,undergarment lingerie active undergarment shoulder fashion model brassiere waist lingerie top leather swimsuit top
455,#comingsoon woman studio capsule collection | edit 2. available november 10th online and selected stores. #collection,205,116000,black black and white shoulder neck fashion joint sleeve monochrome photography monochrome product
456,#comingsoon woman studio capsule collection | edit 2. available november 10th online and selected stores. #collection,258,102300,black shoulder joint waist neck sleeve abdomen fashion design
457,almost friday! leather effectclothing ref 3046/239 now available online and in-stores,557,145300,fashion model sitting shoulder coat fashion outerwear leather girl shoe denim
458,this is #collection | patent finish bikerclothing ref 2969/283 _ striped poplin blouse ref 7903/271 _ boots ref 5120/101,321,83600,clothing jeans fashion model waist sleeve denim abdomen trousers joint trunk
460,kidsseason collection | boys & girls. explore the editorial online and in-stores #collection #editorials,210,77900,shoulder child outerwear girl neck
461,kidsseason collection | boys & girls. explore the editorial online and in-stores #collection #editorials,105,52100,pumpkin product winter squash food toddler child calabaza
462,kidsseason collection | boys & girls. explore the editorial online and in-stores #collection #editorials,73,59200,pumpkin calabaza winter squash cucurbita vegetable squash produce gourd food cucumber gourd and melon family
468,boxes with a past. all cardboard boxes that arrive in our stores are reused up to 5 times before being recycled into new boxes for online orders. boxes made from our own boxes. our online boxes are 100% recycled cardboard. help us to recycle! #recycle #boxeswithapast #collection,245,71300,product design box font brand
469,this is #collection | stretch leather ankle boots ref 5164/101,"1,146",116300,footwear boot shoe riding boot high heeled footwear cowboy boot product design
470,babyseason collection | new editorial. full collection online and in-stores #collection #editorials,304,104300,child toddler table
471,"knits forseason | ""season always reminds me of the mountains. i go there every year with my family"" thank you thibaud charon #editorials #collection",339,81200,fashion model sitting shoe model fashion outerwear formal wear suit sleeve gentleman
472,"knits forseason | ""season reminds me of going on long walks when the leaves are on the turn"" thank you @anders_hayward #editorials #collection",123,60800,black and white sleeve photography t shirt outerwear fashion pattern monochrome photography plaid design
473,woman studio | now available online and selected stores #zarastudio #collection #collection thank you @jamie.hawkesworth,106,57900,black and white jacket photography snapshot monochrome photography girl outerwear standing black hair top
475,woman studio | now available online and selected stores #zarastudio #collection #collection thank you @jamie.hawkesworth,140,75300,standing suit outerwear formal wear vacation sky girl
476,zara woman studio available 20th october online and selected stores #collection. photo by @collierschorrstudio. thank you @micarganaraz,381,92200,fashion model coat fashion jacket overcoat waist sleeve leather
477,zara woman studio available 20th october online and selected stores #collection. photo by @collierschorrstudio. thank you @frejaerichsen_,403,79500,coat formal wear blazer overcoat suit outerwear jacket fashion model sleeve tuxedo
479,zara woman studio available 20th october online and selected stores #collection. photo by @collierschorrstudio. thank you @micarganaraz,315,85000,fashion model model black and white photo shoot beauty supermodel photography monochrome photography standing black hair
480,zara woman studio available 20th october online and selected stores #collection. photo by @collierschorrstudio. thank you @frejaerichsen_,227,90400,white black black and white fashion model standing beauty model photography monochrome photography shoulder
481,zara woman studio available 20th october online and selected stores #collection. photo by @collierschorrstudio. thank you @micarganaraz,207,69100,black black and white beauty photography girl monochrome photography shoulder standing model photo shoot
483,comic meetsclothing | new woman editorial #editorials #collection,"1,134",111300,jacket product leather jacket textile outerwear product leather material top t shirt
484,woman studio #comingsoon #collection with @micarganaraz,127,56600,shoulder black hair joint
485,woman studio #comingsoon #collection,208,61000,footwear product shoe product product design electric blue font outdoor shoe boot ankle
486,woman studio #comingsoon #collection with @frejaerichsen_,100,58100,product picture frame product design product font
488,woman studio #comingsoon #collection,154,74600,product product design font product picture frame brand
489,woman studio #comingsoon #collection with @roosabels,174,81400,shoulder joint neck font
490,woman studio #comingsoon #collection,273,86500,footwear shoe human leg boot ankle high heeled footwear joint
491,"velvet feel |collection editorial. soft metals,season hues, blue nights #editorials #zaracollection",207,55200,clothing fashion model outerwear shoulder neck sleeve day dress peach
493,woman studio #comingsoon#collection,70,51000,box product design product paper
494,knit edit | new woman editorial. check full collection online and in-stores #editorials #collection,299,86600,clothing fashion model outerwear cardigan sweater photo shoot neck model sleeve top
495,knit edit | new woman editorial. check full collection online and in-stores #editorials #collection thank you @graciehartzel,859,121900,white black and white fashion model monochrome photography shoulder standing joint outerwear dress fashion
497,woman studio | #comingsoon | #collection | #countdown stay tuned!,204,61400,footwear leg tights joint thigh boot shoe human leg knee ankle
498,woman studio | #comingsoon | #collection | #countdown stay tuned!,175,65700,footwear shoe leg snapshot joint poster girl knee thigh
499,woman studio | #comingsoon | #collection | #countdown stay tuned!,136,72700,poster hand snapshot finger nail girl font
500,woman studio | #comingsoon | #collection | #countdown stay tuned!,320,84800,black shoulder bag product font brand handbag pattern
501,woman studio | #comingsoon | #collection | #countdown stay tuned!,206,60400,footwear shoe leg foot font girl
502,woman studio | #comingsoon | #collection | #countdown stay tuned!,221,68100,dress outerwear fashion
503,woman studio | capsule collection | coming soon #countdown #newcollection stay tuned!,282,88100,clothing black dress outerwear little black dress fashion formal wear sleeve cocktail dress
504,woman studio | capsule collection | coming soon #countdown #newcollection stay tuned!,118,61100,finger hand poster font brand thumb
505,collection iclothing camp. new editorial. discover the latest collection. thank you @willow.hand @zuzutadeushuk #editorials #zaracollection,260,107100,blue photograph beauty grass girl photography eye fun plant smile
507,"seasonals | essential pieces. double breasted suit. timeless in style, this dark grey two pieces brings a vintage inspired addition to your wardrobe #collection #editorials",179,55800,suit formal wear tuxedo gentleman blazer outerwear fashion model shoe model
508,"seasonals | essential pieces. lapeledclothing. modern classic on a western, button up with this khaki tailoredclothing #collection #editorials thank you @benjamineidem",218,56400,sleeve dress shirt formal wear shirt t shirt outerwear suit gentleman professional top
509,season editorial | explore the full collection in stores and zara.com #collection #editorials,193,72600,technology girl
510,"newseason editorial | ballet, pink & black #collection #editorials now available online and in-stores",375,94000,clothing fashion model outerwear shoulder fashion girl joint sleeve pattern top
511,this is #collection | varsity patchclothing ref 6318/224,264,87900,sleeve outerwear jersey fashion model neck shoe sweater
512,"new editorial | essential pieces, inspired by the mixture of eras and styles. the bomberclothing #collection #editorials thank you @kitbutlerr",512,68000,t shirt formal wear outerwear sleeve fashion suit jacket model gentleman neck
514,welcomeseason! | fringedclothing ref 1628/226 hat ref 3306/209,495,108500,fur clothing fur outerwear fashion model coat sleeve jacket animal product neck
516,go all-in with chokers | shiny suede choker pack ref 1856/281,435,102200,beauty fashion model shoulder model chin neck supermodel photo shoot brown hair long hair
517,this is #collection | faux fur bomberclothing ref 4744/271,664,115300,clothing fashion model outerwear sleeve costume coat shoe joint neck top
518,"join life collection aw.16 | new editorial.a fusion of masculine and feminine style which defines clean silhouettes and a colour palette inspired by mineral tonesselected pieces mainly made of tencelî, a wood fiber extracted from forests that are sustainably managed, guaranteeing its reforestationthe farming process of organic cotton consumes 90% less water than conventional cotton#collection",838,151100,clothing fashion model shoulder joint waist sleeve neck photo shoot model supermodel
519,"join life collection aw.16 | new editorial.the collection embraces a woman who looks into a more sustainable futuremade with materials such as organic cotton, recycled wool and tencelî which reduce our environmental impact#collection thank you @sashapivovarovareal",355,103900,coat sleeve fashion model overcoat neck trench coat model shirt dress shirt jacket
520,shine with metallic __ | lightning detail minaudiere ref 8140/104 #collection,482,96300,fashion model pattern
521,keep it cropped! | bomberclothing ref 5071/243clothing ref 7933/629,302,89200,clothing jacket fashion model sleeve outerwear denim neck coat
522,it's time for suede |clothing ref 2969/251 #collection,403,84500,clothing jacket outerwear sleeve fashion model coat fur product girl
525,new capsule | baby boy. check full collection online and in-stores #collection,384,76500,clothing shoulder joint fashion model fashion neck girl sleeve trunk photo shoot
526,new capsule | baby boy. check full collection online and in-stores #collection,415,134500,person child sitting eye girl human fun nap human behavior hug
527,man | studio collection. now available online and in-stores #collection #editorials,279,75700,furniture sitting table standing shoe chair human behavior gentleman couch professional
528,man | studio collection. now available online and in-stores. thank you @mathias_laur #collection #editorials,405,67900,coat fashion model gentleman fashion outerwear socialite suit overcoat shoe fashion design
529,new editorial | monday-to-friday. now available online and in-stores #collection #season17 thank you mali koopman,355,100000,white black photograph black and white blazer beauty girl monochrome photography photography jacket
530,hello september! striped sweatclothing ref 0085/288 #collection #collection,737,66800,shoulder outerwear design joint sleeve font pattern t shirt brand
531,keep it floral | midi clothing ref 2731/255 #collection,463,85500,clothing day dress fashion model dress shoulder outerwear neck sleeve pattern
532,new capsule collection | chapter 3 #babygirls #collection #zaracapsule,"1,691",204400,clothing shoulder outerwear sleeve product design joint pattern neck shoe
533,new capsule collection | chapter 3 #babygirls #collection #zaracapsule,490,138000,child headgear water girl
534,"it's still season, stay gold #clothing ref 5644/223",345,99200,fashion model dress shoulder day dress neck peach beige model photo shoot supermodel
535,man | the fall report. check season's main trends online and in-stores #editorials #collection,375,53600,fashion outerwear plaid coat tartan jacket pattern design product blazer
536,man | the fall report. check season's main trends online and in-stores #editorials #collection thank you @sogorakos @callumward4 @timurmedt,278,44900,clothing coat suit outerwear fashion jacket formal wear blazer gentleman product
537,this is #collection |clothing ref 7933/629 clothing ref 7907/636,413,97800,clothing fashion model sleeve dress shirt blouse neck top waist shirt girl
538,the school report | check full report online and in-stores #collection #editorials,230,74800,hair child shoulder human behavior smile cheek neck child model brown hair hair coloring
540,the school report | little prices. check full report online and in-stores #collection #editorials,205,60000,shoulder smile standing photography girl fun product joint friendship t shirt
542,hello monday! tricolour clothing ref 5580/251,409,106800,fashion model model beauty supermodel photo shoot shoulder arm human leg brown hair long hair
543,have a wonderful weekend! printed t-clothing ref 5643/298,641,90200,clothing black t shirt sleeve shoulder fashion model neck product joint supermodel
544,go big or go home | satin backpack ref 8812/04,676,92400,bag shoulder product product backpack product design handbag luggage & bags brand
545,not-so-classic hoop earrings ref 1856/274 #collection,433,90600,beauty forehead jewellery ear neck hand lip finger eyelash girl
546,this is #collection | zipped midi clothing ref 4886/259,397,79600,clothing t shirt sleeve fashion model shoulder fashion neck outerwear socialite girl
548,head-to-toe floral __ | it's friday! #clothing ref 4043/276 #clothing ref 4886/264,"1,660",109300,fashion model photo shoot shoulder model supermodel brown hair neck jewellery
549,double or nothing! #collection #tclothing ref 4644/274 #clothing ref 5575/430 #clothing ref 2454/102,"1,183",100400,t shirt clothing sleeve shoulder jeans outerwear shoe product fun font
550,this is #collection |clothing with side band ref 7712/633 silky feel t-clothing ref 1198/232,476,63400,clothing shoulder sleeve neck fashion model joint trousers waist
553,sport | a new attitude. new woman editorial. check gymwear online and in-stores. thank you @ediebcampbell #editorials #collection,450,39100,clothing fashion model fashion outerwear coat jacket model fashion design stylist
