image_id,post_caption,#_comments,#_likes,image_labels
734,#collection #tuesday #newthisweek #collection now available at zara.com #clothing ref: 1938/050,268,67900,clothing fashion model shoulder fashion outerwear blouse long hair top stylist pattern
735,#collection #monday #newthisweek #woman now available at zara.com #clothing ref: 2903/042,350,68000,clothing fashion model outerwear jeans sleeve pattern costume pattern neck trousers
736,#collection #weekend #newthisweek #woman #clothing now available at zara.com ref: 6771/002,205,71000,clothing stole poncho outerwear woolen sleeve shawl neck
737,"new campaign coming soon. womanseason season 2016 by mario sorrenti. thank you vanessa moody, frederikke sofie, lineisy montero and julia bergshoef@mario_sorrenti @vanessa_moody @frederikkesofie @lineisymontero @juliabergshoeff#collection #comingsoon",640,95800,nature sky vacation leisure summer water fun tourism friendship happiness
738,#collection #thursday #newthisweek #collection #clothing now available at zara.com ref: 2177/507,214,65300,tartan plaid fashion model pattern design fashion sleeve coat stylist pattern
739,#collection #wednesday #woman #blouse now available at zara.com ref: 2296/641,212,61400,girl long hair hair coloring brown hair
740,#collection #tuesday #newthisweek #woman #bags now available at zara.com ref: 4222/104,645,86200,bag handbag shoulder joint clothes hanger product neck beige brand pattern
741,#collection #monday #newthisweek #woman #ss16 now available at zara.com #clothing ref: 2221/778 #clothing ref: 2129/778,318,77000,clothing fashion model shoulder dress waist joint trunk abdomen cocktail dress photo shoot
742,#collection #weekend #woman #now available at zara.com #clothing ref: 2262/607 #clothing ref: 2310/607,273,71600,hair human hair color fashion model outerwear long hair hair coloring brown hair model girl neck
743,#collection #thursday #collection #clothing #bomber now available at zara.com ref: 5070/008,"2,713",106000,jacket outerwear sleeve hood military uniform coat
744,#collection #wednesday #collection #bag now available at zara.com ref: 4584/104,"1,371",108600,bag product product handbag product design leather brand baggage shoulder bag luggage & bags
745,#collection #tuesday #woman now available at zara.com #waistclothing ref: 2225/669 #clothing ref: 3666/052 #clothing ref: 1478/029,301,60400,clothing coat formal wear outerwear fashion model blazer suit shoe
746,#collection #monday #collection #clothing now available at zara.com ref: 2098/432,"1,824",93800,clothing blue shoulder sleeve blouse joint electric blue collar neck top
747,#collection #weekend #woman #clothing now available at zara.com ref: 2969/240,214,66200,clothing fashion model coat waist overcoat bag jeans abdomen neck sleeve
748,#collection #thursday #woman #outerwear now available at zara.com ref: 7522/047,383,70800,coat clothing overcoat trench coat fashion model woolen neck beige sleeve
749,#collection #wednesday #collection #sweatclothing now available at zara.com ref: 1165/073,432,88300,clothing shoulder sleeve woolen poncho sweater outerwear neck pattern plaid
750,#collection #tuesday #woman #clothing now available at zara.com ref: 6318/021,165,70100,shoulder pocket coat collar sleeve
751,#collection #monday #woman #clothing now available at zara.com ref: 3198/043,249,63500,clothing dress day dress fashion model formal wear neck sleeve pattern
752,#collection #weekend #woman #clothing #ss16 now available at zara.com ref: 2151/124,209,65100,clothing sleeve fashion model blouse shirt neck collar button pattern pattern
753,#collection #thursday #collection #clothing now available at zara.com ref: 7901/100,404,74800,shoulder dress neck fashion model satin sleeve leather coat overcoat
754,#collection #wednesday #woman #ss16 now available at zara.com #clothing ref: 8073/026 #clothing ref: 2037/110,525,77600,clothing fashion model coat shoulder fashion waist sleeve formal wear overcoat neck
755,#collection #tuesday #woman #clothing now available at zara.com ref: 1152/101,819,80500,footwear shoe high heeled footwear product design outdoor shoe product boot
756,#collection #monday #collection #clothing now available at zara.com ref: 1255/001,200,70600,coat overcoat formal wear woolen gentleman sleeve neck
757,#collection #weekend #woman #hat ref: 3306/203,367,103600,human hair color long hair headgear hair coloring wig brown hair black hair bangs hat layered hair
758,#collection #thursday #woman #clothing now available at zara.com ref: 6873/117,273,81100,clothing woolen outerwear cardigan neck coat sweater fashion model beige
759,#collection #wednesday #woman #clothing now available at zara.com ref: 4688/042,236,69800,clothing shoulder fashion model sleeve neck woolen joint blouse
760,#collection #tuesday #collection #clothing #ss16 now available at zara.com ref: 5070/251,477,71000,fur clothing hood fur overcoat coat jacket
761,#collection #monday #woman #bags now available at zara.com ref: 4278/104,756,104000,bag handbag black product fashion accessory shoulder bag leather product brand product design
762,#collection #weekend #woman #clothing now available at zara.com ref: 2398/302,498,101700,neck fashion model woolen sleeve poncho
763,#collection #thursday #woman #clothing now available at zara.com ref: 6873/115,356,76500,fashion model coat fashion outerwear
764,#collection #wednesday #woman now available at zara.com #clothing ref: 0787/050 #hat ref: 3306/203,424,98000,sleeve shoulder neck t shirt
765,#collection #tuesday #woman #clothing now available at zara.com ref: 7921/368,234,80900,coat clothing outerwear overcoat fashion model tartan pattern plaid
766,#collection #monday #woman #clothing now available at zara.com ref: 1105/101,657,73000,footwear boot product design shoe outdoor shoe ankle product human leg
767,#collection #weekend #collection now available at zara.com #clothing ref: 3427/207 #clothing ref: 6594/202,267,65800,clothing jeans denim pocket fashion model electric blue trousers waist
768,#collection #thursday #collection #clothing now available at zara.com ref: 2057/567,358,76600,clothing stole blouse shoulder sleeve fashion model neck shawl pattern woolen
769,#collection #wednesday #woman #accessories #scarf now available at zara.com ref: 4219/213,390,93500,outerwear neck scarf wool beige woolen stole poncho
770,#collection #tuesday #collection #clothing now available at zara.com ref: 1255/256,722,87100,overcoat fur clothing coat fur collar fashion model woolen hood
771,#collection #monday #woman #clothing now available at zara.com ref: 1200/101,719,60800,footwear shoe high heeled footwear boot product design font
772,#collection #weekend #woman #clothing ref: 6771/144 #clothing ref: 6771/137,487,80700,neck sleeve shoulder woolen sweater long sleeved t shirt
773,#collection #thursday #woman #clothing now available at zara.com ref: 6895/041,763,78600,clothing shoulder sleeve neck blouse t shirt pattern long sleeved t shirt pattern
774,#collection #wednesday #collection #clothing now available at zara.com ref: 1255/001,391,74300,coat woolen outerwear overcoat neck jacket
775,#collection #tuesday #woman now available at zara.com #outerwear ref: 4373/002 #clothing ref: 7816/715,446,66400,fashion model fashion joint abdomen costume shoe fashion design pattern
776,#collection #monday #woman now available at zara.com #clothing ref: 5646/110 #clothing ref: 1628/220,308,80500,plaid tartan sleeve pattern outerwear design woolen neck pocket pattern
777,#collection #weekend #woman #clothing now available at zara.com ref: 6873/137,457,95100,clothing outerwear cardigan fashion model woolen sleeve neck
778,#collection #thursday #collection #clothing now available at zara.com ref: 7521/254,382,71700,clothing fashion model shoulder sleeve outerwear neck blouse
779,#collection #wednesday #woman now available at zara.com #clothing ref: 2044/722,264,52900,fur clothing fur coat fashion model textile overcoat neck
780,#collection #tuesday #collection #clothing now available at zara.com ref: 7224/001,"1,471",77700,footwear high heeled footwear sandal shoe beige product design basic pump outdoor shoe font
781,#collection #monday #woman #clothing now available at zara.com ref: 4566/100,260,78400,clothing woolen sweater neck outerwear sleeve poncho wool fur
782,#collection #weekend #woman now available at zara.com #clothing ref: 2025/163,455,69700,coat overcoat woolen neck collar
783,#collection #thursday #collection #sweatclothing now available at zara.com ref: 5369/270,528,86900,tartan plaid pattern sleeve shoulder neck design fashion model woolen
784,#collection #wednesday #woman now available at zara.com #clothing ref: 6254/119,347,72000,clothing coat formal wear outerwear fashion model overcoat sleeve neck
785,it's cold outside | theclothing edit #editorials thank you @rutgerschoone,262,53400,suit formal wear coat overcoat blazer outerwear gentleman tuxedo jacket
786,#collection #tuesday #collection #waistclothing now available at zara.com ref: 3811/203,455,67300,fur clothing coat fur woolen overcoat beige animal product
787,it's cold outside | theclothing edit #editorials thank you @sophiaahrens,178,65100,beauty eyebrow fashion model chin neck supermodel shoulder cheek model forehead
788,#collection #monday #woman now available at zara.com #clothing ref: 6771/139 #clothing ref: 6771/137,153,58200,clothing day dress dress fashion model sleeve outerwear neck
789,kids | it'sseason! #collection #editorials now online and in-stores,222,69400,nose forehead girl human behavior friendship ear product hair coloring mother smile
790,kids | it'sseason! #collection #editorials now online and in-stores,262,80500,fur clothing fur textile fashion model neck animal product
791,#collection #weekend #woman #clothing now available at zara.com ref: 8317/431,317,77700,clothing fashion model sleeve day dress dress neck outerwear coat pattern overcoat
792,new | key pieces. hand me the right one. now online and in-stores #zarakeypieces #editorials,391,76000,bag handbag product electric blue fashion accessory product product design
793,#collection #thursday #woman now available at zara.com #clothing ref: 3057/266 #clothing ref: 8102/652 #clothing ref: 7823/651,165,55300,clothing fashion model outerwear coat costume neck overcoat cape sleeve
794,new | key pieces. hand me the right one. now online and in-stores #zarakeypieces #editorials,282,82800,fashion model handbag fashion shoe bag supermodel fashion design stylist
795,#collection #wednesday #woman #clothing now available at zara.com ref: 7522/257,517,72900,coat formal wear shoulder outerwear neck overcoat
796,#collection #tuesday #collection now available at zara.com #clothing ref: 1255/215 #tclothing 5039/321 #clothing ref: 7223/201,269,71600,coat overcoat woolen formal wear fashion model trench coat
797,#collection #monday #woman #clothing now available at zara.com ref: 8238/412,326,71200,clothing day dress dress sleeve fashion model neck pattern pattern collar waist
798,#collection #weekend #collection #clothing now available at zara.com ref: 0881/238,255,67500,clothing fashion model day dress fashion dress outerwear neck sleeve pattern pattern
799,kids | ready to party. now in-stores and zara.com #collection,295,63200,necktie chin fashion accessory neck dress shirt white collar worker formal wear professional collar sleeve
800,#collection #thursday #collection now available at zara.com #clothing ref: 1255/204 #clothing ref: 2655/102 #clothing ref: 6594/202 #hat ref: 1323/203,333,67700,coat overcoat woolen fur
801,baby | ready to party. now in-stores and zara.com,421,77900,clothing girl joint shoulder dress leg outerwear shoe sleeve pattern
802,#collection #wednesday #woman now available at zara.com #clothing ref: 4043/274 #clothing ref: 2398/050,399,63000,clothing fashion model neck sleeve day dress pattern collar blouse pattern fashion design
803,#collection #tuesday #collection #clothing now available at zara.com ref: 1165/311,359,64200,day dress dress shoulder outerwear neck fashion model pattern pattern
804,evening editorial | woman & man. now in-stores and zara.com #editorials thank you @matveylykov & @jackchambers,264,53100,suit formal wear tuxedo blazer gentleman white collar worker necktie outerwear businessperson brand
805,#collection #monday #woman now available at zara.com #clothing ref: 6873/135 #sweater ref: 6163/100,323,64600,coat overcoat woolen outerwear neck pattern
806,evening editorial | woman & man. now in-stores and zara.com #editorials thank you @harlethkuusik @lucindaschaefers @alexandraelizabethljadov & @lixiaoxing_li,206,58800,fashion model little black dress dress fashion formal wear shoulder outerwear socialite fashion design coat
807,#collection #weekend #collection now available at zara.com #clothing ref: 5070/207 #clothing ref: 5039/340,176,70000,shoulder neck pattern waist joint
808,evening editorial | woman & man. now in-stores and zara.com #editorials,164,62900,black formal wear suit little black dress fashion model dress fashion shoulder outerwear tuxedo
809,#collection #thursday #woman now available at zara.com #clothing ref: 3440/241 #clothing ref: 0387/164,291,57500,clothing fashion model shoulder fashion neck sleeve waist joint denim fashion design
810,#collection #wednesday #woman now available at zara.com #clothing ref: 3859/137 #clothing ref: 5644/237,237,56400,clothing shoulder joint neck dress sleeve poncho
811,#collection #tuesday #collection #clothing now available at zara.com ref: 1255/216,318,64500,woolen coat outerwear neck collar overcoat jacket sweater wool button
812,#collection #monday #woman now available at zara.com #clothing ref: 6873/116 #clothing ref: 4222/242 #clothing ref: 5119/001,211,66500,coat outerwear fashion model neck overcoat shoe
813,#collection #weekend #woman #clothing now available at zara.com ref: 8250/416,399,65100,clothing fashion model day dress fashion shoulder dress design neck pattern pattern
814,#collection #thursday #woman now available at zara.com #clothing ref: 8177/373 #clothing ref: 8128/716,348,69400,clothing fashion model formal wear waist trunk trousers abdomen neck suit pattern
815,#collection #wednesday #collection #clothing now available at zara.com ref: 8203/566,"1,017",98300,clothing day dress dress fashion model sleeve shoulder neck pattern blouse waist
816,#collection #tuesday #woman #clothing now available at zara.com ref: 6146/001,874,72100,footwear boot shoe high heeled footwear product design product human leg riding boot
817,new editorial | boys & trees. available online and in-stores #editorials,288,77100,photograph people photography tree standing child outerwear fun toddler recreation
818,#collection #monday #woman now available at zara.com #clothing ref: 1112/154 #clothing ref: 7632/673,154,64300,clothing sleeve fashion model outerwear neck
819,new editorial | boys & trees. available online and in-stores #editorials,121,68600,blue nature photograph tree photography poster water fun grass plant
820,happy halloween!,723,92500,outerwear girl pattern neck sleeve sweater child model
821,collection | a new grunge. now online and in-stores #editorials,215,70500,fashion model shoulder fashion outerwear tights coat shoe
822,collection | a new grunge. now online and in-stores #editorials thank you @karlyloyce,139,42100,jeans waist fashion model denim fashion abdomen sleeve trousers pattern trunk
823,#collection #weekend #collection now available at zara.com #clothing ref: 5252/219 #clothing ref: 5252/218,763,78900,denim pocket waist jeans button miniskirt joint trousers
824,collection | a new grunge. now online and in-stores #editorials thank you @marjanjonkman,"1,080",66100,denim jeans outerwear fashion model sleeve jacket button blouse shirt pattern
825,#collection #thursday #woman #clothing now available at zara.com ref: 8105/777,189,52900,blue clothing day dress electric blue shoulder dress turquoise joint cobalt blue fashion model
826,#collection #wednesday #woman #clothing now available at zara.com ref: 4886/274,330,71600,clothing blouse sleeve neck fashion model pattern collar pattern top button
827,#collection #tuesday #woman now available at zara.com #poncho ref: 6873/126 #clothing ref: 7961/775,192,68700,clothing fashion model shoulder outerwear neck joint sleeve leggings
828,#collection #monday #woman now available at zara.com #overclothing ref: 5070/213 #polo ref: 1198/229 #clothing ref: 6164/196,331,76800,coat trench coat overcoat fashion model sleeve jacket
829,new | key pieces. mix and match. now available at zara.com and in-stores #keypieces,"1,027",78000,footwear shoe human leg leg high heeled footwear outdoor shoe ankle product design calf
830,new | key pieces. mix and match. revamp your wardrobe with pattern and colour. now available at zara.com and in-stores. #keypieces,255,71100,footwear fashion model shoulder shoe outerwear fashion coat pattern joint
831,new | key pieces. mix and match. revamp your wardrobe with pattern and colour. now available at zara.com and in-stores. thank you @rosgeorgiou #keypieces,360,63100,fashion model formal wear shoulder blazer fashion outerwear suit gentleman necktie supermodel
832,#collection #weekend #woman #bag now available at zara.com ref: 8099/004,691,85400,bag black handbag shoulder bag fashion accessory product product leather pattern brand
833,#collection #thursday #collection now available at zara.com #tclothing ref: 2589/272 #shorts ref: 7901/321,219,66800,clothing yellow shoulder fashion model sleeve fashion waist blouse neck joint
834,greetings from @harmonyboucher #clothing,347,66600,hair blond human hair color hairstyle boy hair coloring neck surfer hair portrait bangs
835,#collection #wednesday #woman now available at zara.com #clothing ref: 2655/100 #clothing ref: 8209/112,499,75200,shoulder fashion model neck sleeve joint waist trunk abdomen
836,#collection #tuesday #woman #clothing now available at zara.com ref: 8049/411,201,59100,clothing fashion model dress outerwear fashion sleeve neck pattern day dress
837,#collection #monday #collection now available at zara.com #clothing ref: 1255/241 #clothing ref: 7162/001,323,63800,clothing coat formal wear outerwear overcoat suit shoe neck
838,happy weekend #accessories #scarf,505,88100,scarf neck outerwear textile hair coloring long hair brown hair wool girl fur
839,#collection #weekend #woman now available at zara.com #clothing ref: 8212/402 #bag ref: 4520/204 #clothing ref: 7188/001,666,84600,bag handbag fashion accessory shoulder fashion model fashion joint shoe pattern brand
840,seasonals man | now in-stores and zara.com #zaraseasonals,425,51700,coat overcoat woolen sleeve formal wear gentleman neck collar button
841,#collection #thursday #collection #clothing #fauxfur now available at zara.com ref: 3811/208,966,65700,fur clothing fur coat fashion model animal product sleeve
842,seasonals man | now in-stores and zara.com #zaraseasonals,447,52000,fashion model shoulder fashion sleeve neck tights trousers leggings formal wear
843,greetings from @maja_nw #collection,188,78600,shoulder outerwear hand neck finger girl pattern sleeve
844,#collection #wednesday #woman #bricklane now available at zara.com #clothing ref: 7786/215 #clothing ref: 8212/402,241,66900,clothing fashion model sleeve fashion blouse socialite shirt denim pattern top
845,seasonals man | now in-stores and zara.com thank you @yannickabrath #zaraseasonals,974,55500,jacket formal wear blazer suit sleeve gentleman outerwear collar button neck
846,#collection #tuesday #collection now available at zara.com #tclothing ref: 4873/273 #clothing ref: 6855/911,329,69000,clothing fashion model shoulder waist neck sleeve miniskirt
847,#collection #monday #woman now available at zara.com #clothing ref: 7521/401,763,75000,jacket woolen sleeve product
848,new |clothing all over #editorial #clothing now available in-stores and zara.com,258,57900,clothing white outerwear neck fashion model formal wear costume sleeve fashion design pattern
849,new |clothing all over #editorial #clothing,259,56300,clothing neck outerwear coat sleeve shoe
850,happy weekend,336,89500,human hair color fashion model shoulder photo shoot outerwear neck supermodel long hair blond girl
851,#collection #weekend #woman now available at zara.com #clothing ref: 2281/100 #shortclothing ref: 2398/307,480,73000,clothing shoulder fashion model waist neck sleeve fashion dress abdomen joint
852,new |clothing all over #editorial #clothing thank you @margauxlenot,222,51200,tights fashion model fashion shoe design pattern leggings trousers neck
853,#collection #thursday #woman now available at zara.com #parka ref: 8073/250 #clothing ref: 5755/008 #clothing ref: 6594/202,286,46100,bag shoulder jeans pocket electric blue fashion model fur waist coat denim
854,#collection #wednesday #woman now available at zara.com #clothing ref: 3859/140 #clothing ref: 7149/254 #hat ref: 3306/203,338,89900,fashion model shoulder fashion dress waist joint socialite pattern neck fashion design
855,greetings from @oliwiawedzicha #collection,293,98600,hair beauty hairstyle fashion model smile fashion outerwear girl socialite long hair
856,#collection #tuesday #collection now available at zara.com #clothing ref: 7521/239 #clothing ref: 5039/276 #belt ref: 1736/206,626,81500,clothing sleeve outerwear fashion model jacket shoulder neck pattern woolen blouse
857,#collection #monday #woman #season now available at zara.com #clothing ref: 5854/224,279,54900,coat overcoat fashion model woolen neck beige peach collar
858,new baby boy collection | now available at zara.com and in-stores #babyboy #season,"1,234",91500,outerwear child shoulder toddler design sweater pattern wool girl neck
859,new baby boy collection | now available at zara.com and in-stores #babyboy #season,"1,661",90400,yellow cap headgear hat beanie sun hat font electric blue
860,#collection #weekend #woman #season now available at zara.com #sunglasses ref: 2727/206 #clothing ref: 8090/696,277,70700,eyewear vision care sunglasses glasses brown hair hair coloring health & beauty neck bangs
861,new | key pieces. evening wear becomes day wear. now available in-stores and zara.com #keypieces,785,46400,footwear yellow shoe sandal pattern design outdoor shoe flooring ankle human leg
862,#collection #thursday #woman #season now available at zara.com #clothing ref:3833/221 #clothing ref: 4070/223 #clothing ref: 5308/001,348,62200,coat fashion model overcoat trench coat fur
863,new | key pieces. evening wear becomes day wear. now available in-stores and zara.com #keypieces,84,64300,clothing shoulder joint leg outerwear shoe trunk leggings tights abdomen
864,#collection #wednesday #collection #clothing #season now available at zara.com ref: 2589/275,375,72400,clothing sweater sleeve woolen shoulder neck outerwear pattern cardigan wool
865,new | key pieces. evening wear becomes day wear. now available in-stores and zara.com #keypieces,192,61800,clothing shoulder fashion pattern socialite shoe trunk waist abdomen joint
866,#collection #tuesday #woman now available at zara.com #bag ref: 8008/004 #clothing ref: 5113/001,329,76000,bag leather product handbag
867,evening wear becomes day wear | tea break #keypieces thank you @laurakampman,219,61400,outerwear jacket fashion long hair jeans girl denim
868,#collection #monday #collection #sweatclothing #patchwork now available at zara.com ref: 1165/285,565,85800,clothing shoulder sleeve outerwear fashion joint neck product pattern blouse
869,new | playing basics. boys #season now available in-stores and zara.com,446,65800,plaid sleeve tartan pattern collar button design dress shirt neck shirt
870,new | playing basics. girls #season now available in-stores and zara.com,378,72000,clothing shoulder waist fashion model neck sleeve day dress miniskirt one piece garment joint
871,greetings from @rozanneverduin #collection #clothing,277,94900,hair photograph human hair color beauty girl photography sky blond long hair smile
872,#collection #weekend #collection now available at zara.com #clothing ref: 8342/208 #clothing ref: 7937/515 #clothing ref: 7295/001,261,57300,clothing fashion model shoulder jeans waist fashion trousers joint shoe neck
873,#collection #thursday #woman #season now available at zara.com #blazer ref: 8003/819 #clothing ref: 2655/100 #clothing ref:8000/819 #clothing ref: 5119/001,346,58200,clothing coat fashion model outerwear overcoat shoe formal wear blazer neck
874,#collection #wednesday #woman now available at zara.com #clothing ref: 6771/122 #clothing ref: 7823/651 #clothing ref: 7297/001,123,53000,clothing fashion model coat fur clothing outerwear neck woolen pattern fur sleeve
875,hello fall #collection #season,150,57500,shoulder outerwear design square pattern
876,#collection #tuesday #woman #bags #season now available at zara.com ref: 8437/004,828,81700,bag brown fashion accessory handbag shoulder bag leather product product product design beige
877,seasonals | fall is back. thank you @alisaahmann #zaraseasonals #season now available in-stores and zara.com,358,66500,shoulder fashion accessory joint handbag neck photo shoot waist
878,#collection #monday #woman #season now available at zara.com #jumpsuit ref: 3564/156 #clothing ref: 5119/001,525,71400,clothing fashion model shoulder waist joint neck trunk abdomen formal wear trousers
879,seasonals | fall is back. thank you @alisaahmann #zaraseasonals #season now available in-stores and zara.com,155,60900,clothing coat blazer outerwear fashion fashion model jacket formal wear overcoat pattern
880,seasonals | fall is back. thank you @alisaahmann #zaraseasonals #season now available in-stores and zara.com,131,64000,fashion model sitting beauty supermodel photo shoot shoulder photography leg thigh model
