image_id,post_caption,#_comments,#_likes,image_labels
193,this is #collection | timelessclothing #clothingclothing ref 5252/015 #shorts ref 9123/252 #zaracollection #season,221,72800,clothing denim fashion model jeans fashion outerwear sleeve model fashion design
194,this is #collection |clothing +clothing #zaracollection check new items online and in-stores #season,193,87500,clothing black and white fashion model sleeve outerwear fashion coat shirt monochrome photography dress shirt
198,it's time to play | girls editorial #collection #editorial,525,151400,clothing sleeve t shirt shoulder joint outerwear product neck top girl
199,it's time to play | girls editorial #collection #editorial,242,139800,yellow shoulder shoe neck outerwear joint product pattern
201,this is #collection | poplinclothing ref 7876/117 palazzoclothing ref 0594/040,365,94700,clothing day dress shoulder dress fashion model joint fashion sleeve outerwear neck
202,this is #collection | clothing ref 5580/160,501,133100,clothing t shirt shoulder sleeve dress joint neck product
203,this is #collection #clothing ref 2660/797 #bag ref 6304/205,329,87900,white bag yellow handbag shoulder fashion outerwear pattern shoe
204,the polka dot | #zaracollection t-clothing ref 5039/101,406,80900,fashion model black and white shoulder fashion design pattern joint trunk abdomen fashion design
206,this is #collection | the timeless polka dot #tclothing ref 0264/288,197,79000,black and white shoulder pattern design monochrome photography polka dot fashion monochrome photo shoot retro style
207,it_s time to play | new editorial for kids #collection #editorial,237,79400,photograph shoulder standing product shoe joint furniture
208,it_s time to play | new editorial for kids #editorial #collection,198,89100,clothing t shirt shoulder denim textile jeans sleeve outerwear product fashion
209,it_s time to play | new editorial for kids #collection #editorial,173,87600,hair photograph facial expression microphone smile emotion fun laughter outerwear sunglasses
210,tricolor plaited tote bag 4041/204,469,119500,fashion model shoulder neck tartan sleeve pattern nightwear retro style plaid handbag
211,vinyl high heel sandals for this season ref 6552/201 and striped palazzoclothing ref 9878/024,512,142400,pink shoulder day dress waist joint peach trunk neck abdomen pattern
212,ready for the weekend? more accessories online and in-stores #itsfriday ref 4373/039,344,91100,hat sun hat headgear fashion accessory fedora cowboy hat
213,upcycled fabrics | recycled polyester is made from recovered plastic bottles #collection #collection #careforfiber,179,76400,footwear shoe shoulder joint outerwear neck sleeve shorts human leg beige
214,sustainable raw materials | recycled cotton is made from residue collected from the cutting processes #collection #collection #careforfiber,152,82500,sleeve outerwear shoulder neck t shirt headgear jeans trousers pocket cap
216,young and resolute | newcollection editorial. mariana wears graphic t-clothing #zaracollection #editorial,248,98600,clothing t shirt black and white shoulder sleeve joint neck model monochrome photography muscle
218,young and resolute | newcollection editorial. cara wears oversized text t-clothing #zaracollection #editorial,140,71800,t shirt white black and white shoulder joint sleeve fashion fashion model monochrome photography neck
219,season holidays | one day at the swimming pool #collection #editorial,278,113500,clothing swimwear aqua turquoise shorts shoulder one piece swimsuit fashion model swimsuit top t shirt
220,season holidays | kids editorial #collection,136,69100,cap headgear beanie outerwear hair accessory hat
221,season holidays | kids editorial. enjoy at the swimming pool #collection,175,103600,child toddler smile girl fun neck pattern
222,color block collection now available online and in-stores #collection,194,69000,sleeve t shirt shoulder neck outerwear jersey joint collar sportswear
223,color block collection now available online and in-stores #collection,101,54600,white sleeve t shirt collar product shoulder outerwear neck product formal wear
224,color block collection now available online and in-stores #collection,139,69100,sleeve t shirt shoulder headgear outerwear cap protective gear in sports arm neck electric blue
225,that beach feeling | woman editorial #collection #editorial,165,82000,outerwear robe coat neck costume
226,next destination: the beach | woman editorial #collection #editorial,136,80500,clothing yellow shoulder joint dress trunk abdomen neck vacation pattern
227,let_s drive to the beach | woman editorial #collection #editorial thank you @imaanhammam,233,111000,fashion model shoulder handbag fashion accessory joint waist fashion miniskirt trunk thigh
228,stripes fromclothing to bottom | blue shades woman editorial #collection #editorial,197,113200,clothing vacation shoulder dress outerwear summer neck sand joint shorts
229,"stripes are everywhere | blue shades. woman editorialnow available online and in-stores #collection #editorialthank you @shelbyhayes00",367,144800,clothing photograph shoulder shoe outerwear vacation sitting joint summer neck
230,blue shades for stripes | new woman editorial #collection #editorial thank you @graciehartzel,165,74600,headgear cap hair accessory sun hat beanie knit cap hat neck headpiece
231,tropical printclothing | man #collection,380,74000,fashion model shoulder model fashion joint t shirt sleeve photo shoot neck supermodel
233,tropical leaf | prints + prints for man #collection,161,66700,eyewear t shirt sleeve neck sunglasses vision care cool collar
234,exotic allure | kiki wears the floral printed kimono clothing #collection #editorial,652,100500,clothing textile day dress formal wear pattern pattern
235,light and enveloping kimono for an exotic allure #collection #editorial,379,106200,clothing shoulder day dress sleeve costume fashion model neck robe nightwear kimono
236,"long lengths, fluid and voluminous, it's an exotic allure. thank you @kdhwillems #editorial #collection",309,101800,clothing blue shoulder costume pattern day dress joint
237,"pack your tent, it's time for season camp | kids editorial #collection #editorial",192,131500,photograph girl smile outerwear fun child happiness toddler vacation friendship
238,time for season camp | new kids editorial #collection #editorial,89,86700,property architecture building facade angle roof elevation house
239,ready for a season camp | check kids editorial #collection #editorial,381,191000,clothing denim jeans shoulder outerwear toddler sleeve child shorts girl
241,let's go for a season getaway | the vacation edit #collection #editorial,201,114200,sitting leg fashion model lingerie human leg thigh photo shoot shoe undergarment model
242,this is the vacation edit | woman editorial. thank you @jean_campbell #collection #editorial,226,108400,sitting leg thigh human leg undergarment shoe
243,free inclothing | new man editorial.clothing with embroidered floral motifs #collection #editorial thank you @kitbutlerr,293,85300,fashion outerwear neck sleeve denim model photo shoot jacket
244,free inclothing | new man editorial now available #collection #editorial thank you @oscarkindelan,130,82100,sleeve outerwear dress shirt neck cool t shirt denim top model jeans
245,free inclothing | new man editorial.clothing with embroidered floral motifs #collection #editorial,513,139600,shoulder joint neck
249,neon |collection editorial now available online and in-store #zaracollection #editorial,262,73200,joint shoulder standing physical fitness arm leg tights human leg thigh balance
250,stay bright! neon. newcollection editorial #zaracollection #editorial,333,115800,yellow sitting beauty fashion model shoulder leg black hair model photo shoot girl
252,blooming | check out new woman editorial #editorial #collection thank you @katerynazub,317,109800,photograph black and white monochrome photography photo shoot photography flower monochrome stock photography girl
253,blooming | check out new woman editorial #editorial #collection thank you @micarganaraz,174,73400,clothing costume outerwear fashion model formal wear white coat neck robe suit
254,blooming | new woman editorial just released #editorial #collection,247,96200,yellow clothing dress flower spring summer meadow wildflower grass field
255,girls season collection now available | all over print clothing #collection #editorial,502,150800,clothing fashion model day dress dress shoulder joint neck cocktail dress sleeve photo shoot
256,ready to catch the wave | baby boy season collection now available #collection #editorial,177,90900,surfing equipment and supplies surfboard wood sports equipment
257,printed flowing jumpsuit | baby girl season collection now available #collection #editorial,549,194500,photograph sitting girl toddler child photo shoot child model portrait photography shoe pattern
258,southern air | bows + polka dots. new woman editorial #collection #editorial,329,117300,clothing shoulder fashion model joint design polka dot sleeve pattern waist neck
260,clothing with fringes for a southern air | woman editorial #collection #editorial thank you @mckennahellam,262,97500,fashion model model shoulder supermodel photo shoot leg lingerie thigh arm long hair
261,"kids girls editorial | play, laugh, it's a season ride #editorial #collection",326,119600,photograph snapshot dress vacation ceremony
262,let's go for a season ride | kids girls editorial #collection #editorial,193,103500,blue photograph sitting shoulder fashion accessory photography vacation leisure product shoe
263,"time for fun, it's sunny | kids girls new editorial #collection #editorial",376,163200,blue clothing fashion model shoulder electric blue joint fashion girl shoe costume
265,"peplum, it's a nautical vibe | new woman editorial #collection #editorial",346,111500,white clothing shoulder joint costume neck outerwear sleeve formal wear gown
266,nautical vibes with a femenine touch | woman editorial now available online and in-stores #editorial #collection thank you @damarisgoddrie,307,138800,white shoulder joint waist neck fashion model arm abdomen trunk sleeve
267,smile and have fun | a long season day #collection #editorial,230,143300,photograph shoulder romance interaction gown bride wedding stock photography neck honeymoon
268,new boys editorial | a long season day #collection #editorial,242,173800,t shirt boy shoulder sleeve outerwear product arm cool neck child
269,a long season day | boys new editorial #collection #editorial,162,130800,green outerwear tree stock photography angle product
272,"time for sun, pieces made for sun |collection editorial. floral prints and shorts #zaracollection #editorial #madeforsun",232,103500,shoulder outerwear fashion model photo shoot sleeve neck product
273,man editorial | tailoring. formal suits to wear this season. navy / grey / pale blue #collection #editorial,260,77700,suit formal wear tuxedo gentleman outerwear blazer white collar worker businessperson
274,man editorial | tailoring. relaxed looks to enjoy thisseason. white / pannacotta / pale pink #collection #editorial,470,89500,shoulder fashion model neck outerwear fashion joint sleeve supermodel peach model
275,man editorial | tailoring. relaxed looks to enjoy thisseason. white / pannacotta / pale pink #collection #editorial thank you mathias lauridsen,240,81500,plaid suit outerwear shoulder fashion sleeve design pattern formal wear dress shirt
276,collection #oilonclothing | limited collection in collaboration with @mercedesbellido available online #zaracollection,346,70100,clothing denim jeans fashion model shoulder fashion outerwear trousers sleeve fashion design
277,collection #oilonclothing | limited collection in collaboration with @ricardocavolo available online #zaracollection,484,61300,clothing fashion model fashion outerwear shoe jeans trousers neck leggings pattern
278,collection #oilonclothing | limited collection in collaboration with @yimeisgreat available online #zaracollection,291,79200,clothing fashion model fashion denim day dress outerwear shoe fashion design pattern pattern
279,the perfect accessory. natural fiber handbag with contrasting stripe detail down the front #collection ref 4751/001,675,100400,bag shoulder handbag joint product pattern neck pattern
280,the flatform espadrilles. for urban streets or sandy beaches #collection ref 1357/201,601,125000,footwear shoe sandal outdoor shoe beige product design high heeled footwear
281,panama-style hat for sunny days 3920/010 #collection,364,114700,hat headgear fedora sun hat cap beige
282,"this isclothing | new man editorial.season seasonproposals for your day to day easy fitclothing looks #editorial #collection #clothing",229,63800,shoulder outerwear neck t shirt sleeve pocket jacket joint
283,this isclothing | new man editorial. ripped overclothing #editorial #collection #clothing,155,78400,black and white jacket photography monochrome photography outerwear zipper gentleman pattern design sleeve
284,this isclothing | new man editorial. key pieces from theclothing collection full of destroyed and damaged surfaces #editorial #collection #clothing thank you @robertosipos,176,72300,jeans shoulder denim fashion model trousers joint
285,girls new editorial | soft collection. striped jumpsuit with bows #editorial #collection,313,109000,black and white fashion model shoulder monochrome photography neck monochrome photo shoot day dress model joint
287,girls new editorial | soft collection. peplum striped blouse with bows at the back #editorial #collection,241,120400,photograph sitting black and white standing photography monochrome photography photo shoot shoulder girl monochrome
288,"season breeze | woman editorial. noemie wears ruffledembroidered floralclothing #editorials #collection",211,73900,fashion model model shoulder photo shoot beauty supermodel cocktail dress black hair joint neck
290,season breeze | harleth wears floral printedclothing and striped asymmetric ruffle clothing #editorial #collection #seasonbreeze,185,76900,fashion model shoulder supermodel neck model photo shoot day dress joint sleeve
292,reworked white | newcollection editorial now available #zaracollection #editorial #white thank you @matteomontanariphotography,287,93900,white clothing fashion model shoulder joint dress neck fashion sleeve eyewear
294,new this week | frills + blue. frilled-sleeve clothing 1639/087 boots 2117/201 frayedclothing 2898/886clothing with belt 2423/712,266,93200,clothing fashion model fashion dress outerwear day dress fashion design professional shoe pattern
295,new this week | gingham & floral print. gingham clothing 3564/096 draped floral printclothing 2856/266clothing with belt 2423/712 ankle boots 1113/201 floral print clothing 2884/149,208,83300,clothing fashion model dress fashion day dress shoulder waist catwalk fashion design pattern
296,new this week | orange + pink.clothing with front knot 0858/041 frilled midi clothing 7149/081 frilly blouse 2874/201 assymetric ruffles clothing ref 2908/201 #collection #newthisweek,230,67000,clothing pink fashion model fashion shoulder dress magenta joint catwalk fashion design
297,realclothing | new woman editorial. freja wears the distressedclothing and the slim boyfriend in candiani pink #collection #editorials #clothing,442,79500,pink clothing shoulder fashion model sleeve pajamas neck joint magenta shoe
298,clothing | freja wears the boyfit in rose blue. womanclothing real collection #collection #editorials #clothing,167,63700,clothing white jeans fashion model joint shoulder black and white standing waist sleeve
299,realclothing | new woman editorial. freja wears the distressedclothing and the slim boyfriend in candiani pink #collection #editorials #clothing,291,78800,clothing pink fashion model coat fashion outerwear jacket pajamas
300,"collection | sustainable collection #collection #collection #careforfiber. the production processes of recycled fabrics use less water and energy, fewer natural resources and produce less waste, meaning they have a lower environmental impact",325,75300,clothing shoulder cobalt blue electric blue sleeve fashion model neck headgear pattern nightwear
301,collection | sustainable collection #collection #collection #careforfiber. organic cotton is farmed in a way that respects the biodiversity like crop rotation and the use of natural fertilizers,243,83100,clothing white sleeve fashion model t shirt shoulder joint fashion neck muscle
303,baby boy new editorial | pieces with cotton feeling #collection #editorials,181,89100,footwear shoulder joint leg shoe sitting flooring girl arm child
304,mini new capsule collection | now available online and in-stores #zaramini #editorials,658,183300,girl child photo shoot toddler portrait photography neck
305,baby boy new editorial | cozy fabrics forseason #collection #editorials,166,84800,skin shoulder neck joint child arm girl product
306,new kids editorial : prints + prints #editorials #collection,141,57700,clothing shoulder dress t shirt outerwear sleeve day dress joint neck pattern
307,new kids editorial : prints + prints #editorials #collection,142,83400,standing shoulder child human behavior sitting outerwear toddler girl pattern product
308,mixed patterns | new kids editorial : prints + prints #editorials #collection,150,67900,clothing fashion model shoulder dress pattern day dress design pattern photo shoot joint
309,"woman campaign collection now available online and selected stores#zaraseasoncollection #zaraballerinaoffduty",150,62400,black and white coat monochrome photography photography shoulder fashion photo shoot model outerwear gentleman
311,"new woman capsule now available online and selected stores | limited quantity#zaraseasoncollection #zaraballerinaoffduty",164,68000,coat jacket overcoat outerwear neck long hair leather jacket leather
315,it's mid season sale online and in-stores #zaramidseason,230,53500,sleeve shoulder neck outerwear knitting design pattern sweater joint poncho
316,it's mid season sale online and in-stores #zaramidseason,189,42400,jacket hood leather jacket hoodie zipper textile leather sleeve
317,it's mid season sale online and in-stores #zaramidseason,110,45100,photograph headgear outerwear standing portrait black and white design smile pattern sleeve
318,back to office | monday to friday. new woman editorial now available online and in-stores #collection #editorial,207,59600,shoulder outerwear formal wear angle suit
320,back to office | monday to friday. new woman editorial now available online and in-stores #collection #editorial,133,69000,photograph black and white monochrome photography photography fashion accessory outerwear monochrome angle stock photography
321,man studio | new editorial available #collection #editorial,197,67700,outerwear jacket sleeve product blouse neck pattern
323,man studio | new editorial available #collection #editorial,143,59000,coat overcoat outerwear collar neck sleeve
324,knitseason | new woman editorial #collection #editorial,337,103100,clothing fashion model shoulder sleeve joint fashion waist supermodel neck day dress
325,knitseason | the new editorial for woman is now available online and in-stores #collection #editorial,488,109700,clothing white fashion model black and white sleeve shoulder photo shoot neck joint model
326,check new woman editorial |season knit. thank you @arizona_muse #editorial #collection,279,108000,yellow bag shoulder woolen sleeve outerwear neck handbag joint
327,this is #collection | blazer ref 2177/105 necklace ref 4319/029,184,54800,fashion model beauty shoulder model fashion black hair neck socialite girl black model
328,this is #collection | t-clothing ref 0264/026 waistclothing ref 7484/020 bag ref 4423/204,135,51900,yellow shoulder t shirt outerwear fashion arm neck uniform product professional
329,this is #collection | floral printed clothing ref 2183/042 and bag ref 4423/204,232,71800,fashion model fashion shoulder pattern blouse t shirt neck product
330,it's time forclothings! available in stores and online #collection #timefor,267,57700,jacket leather jacket overcoat coat zipper hood leather sleeve pocket collar
332,it's time forclothings! available in stores and online #collection #timefor,292,77700,jacket leather jacket leather shoulder fashion model material zipper sleeve neck
333,kids | special prices available in stores and online #collection #season,399,117600,sleeve shoulder fashion model t shirt neck brown hair joint top model product
334,kids | special prices available in stores and online #collection #season,191,74000,facial expression smile child girl product brown hair child model
335,kids | special prices available in stores and online #collection #season,131,54800,clothing sleeve t shirt shoulder outerwear joint neck product font shoe
337,woman | new romantic collection available in stores and online #collection #editorial #season,281,96000,clothing outerwear coat girl fashion textile top jacket sleeve costume
338,woman | new romantic collection available in stores and online #collection #editorial #season thank you @graciehartzel and @eliseagee,349,104400,clothing fashion girl long hair
339,man | stripes #collection #season #stripes available in stores and online. thank you @callumward4,223,63300,clothing shoulder sleeve outerwear jeans joint neck trousers shoe t shirt
341,man | stripes #collection #season #stripes available in stores and online,169,46400,sleeve dress shirt t shirt male shirt outerwear shoulder neck cool model
342,girl | capsule collection #collection #season available in stores and online,158,96200,photograph pink room shoulder standing girl window wood joint door
343,girl | capsule collection #collection #season available in stores and online,130,86300,white photograph black facial expression black and white girl smile monochrome photography photography emotion
344,girl | capsule collection #collection #season available in stores and online,221,126600,white clothing girl shoulder product fashion blond leg socialite t shirt
345,baby girl | artisan capsule collection #collection #season,860,180100,child toddler girl
346,baby girl | artisan capsule collection #collection #season,728,195400,girl child hair accessory smile fun
347,baby girl | artisan capsule collection #collection #season,742,214400,shoulder joint shoe girl
348,"blazers i new volumes, new silhouettes #collection #editorial",164,64100,black and white model beauty gentleman suit fashion model photography monochrome photography formal wear photo shoot
350,"blazers | new volumes, new silhouettes #collection #editorial thank you @cara_taylorrr",150,76300,black black and white model fashion model gentleman photography monochrome photography shoulder photo shoot outerwear
351,this is #collection | floral embroidered clothing ref: 3440/047,303,66500,clothing white shoulder sleeve joint fashion dress blouse pattern neck
352,this is #collection | embroidered blazer ref: 2903/060,216,70600,fashion model fashion outerwear socialite product supermodel pattern pattern sleeve fashion design
353,this is #collection | floral printed blouse ref: 2352/639,124,65000,clothing white fashion model fashion outerwear pattern sleeve trunk blouse top
354,time for camo tonedclothings #collection #timefor camouflage parka ref: 3918/470,205,49700,jacket outerwear gentleman sleeve fashion model neck button coat collar
356,time for camo tonedclothings #collection #timefor oversized trenchclothing ref: 1792/407,105,50900,shoulder outerwear gentleman formal wear jacket beige sleeve product joint neck
357,collection |clothing made withclothing #zaracollection #editorial,323,71900,clothing pink fashion model shoulder stole jeans joint sleeve girl blouse
358,collection | refixedclothing to look handcrafted #zaracollection #editorial,221,65300,sitting footwear jeans beauty fashion model denim girl shoe standing photo shoot
359,newcollection editorial |clothing +clothingclothing #zaracollection #editorial thank you @sofiehemmet and @matteomontanariphotography,197,81900,fashion model human hair color beauty model photo shoot supermodel shoulder blond long hair muscle
360,accessories matter | chain necklace ref 1856/030,161,61300,jewellery necklace chain neck
361,shine bright with metallic boots #collection ref 3155/201,390,55500,footwear white shoe boot product design high heeled footwear product ankle walking shoe
362,the perfect combination | khaki and sequins #parka ref 6895/057 #collection,138,53000,bag shoulder handbag fashion joint jeans product pattern
363,time for message sweatclothings #collection #timefor ref 0722/406,165,61700,t shirt white photograph sleeve man black and white shoulder neck male photography
365,time for message sweatclothings #collection #timefor ref 0722/433,308,65000,photograph black and white chin male t shirt photography forehead monochrome photography portrait model
366,girlsseason collection available online and in stores #collection,217,86300,clothing fashion model shoulder outerwear sleeve joint leggings shoe neck waist
367,boysseason collection available online and in-stores #collection,89,70500,black sleeve t shirt black and white shoulder photography standing male neck monochrome photography
368,girlsseason collection available online and in-stores #collection,198,103600,coat outerwear beige peach
369,pink | new woman editorial. now available online and in-stores #collection,177,50300,clothing robe magenta costume coat outerwear pattern
370,pink | new woman editorial. now available online and in-stores #collection,295,91900,fashion model clothing pink shoulder dress model fashion supermodel sleeve photo shoot
