image_id,post_caption,#_comments,#_likes,image_labels
0,"join life is about sustainability, about taking care of the planet.join us to learn more about join life at zara.com",382,105600,musical instrument musical instrument accessory product design drum percussion accessory electronic instrument tom tom drum drums
2,this is #collection. garments produced using the best sustainable processes and raw materials. do you want to join us? check editorial online and in-stores,132,54900,bag handbag leather shoe material jacket
3,"add a bit of sparkle to your night out | check total look at our party wear editorial, night out",175,56000,clothing fashion model black and white blazer outerwear sleeve shoulder formal wear jacket model
4,night out | party season is coming. velvet and sequins are the perfect choice. check our new woman editorial for some inspiration,228,65400,fashion model dress formal wear polka dot pattern design neck fashion day dress fashion design
5,shine bright with this metallic blazer clothing from our latest woman editorial | all you need for your nights out. thank you @graciehartzel,570,106000,clothing fashion model black and white shoulder sleeve outerwear model fashion joint monochrome photography
6,from funk and disco to clothinged-up casual wear | this is a step to your new routine #zaracollection new editorial,255,89900,fur clothing fur fashion model headgear fashion furcap textile coat beanie animal product
8,"this is my new routine, clothinged up casual wear | checkcollection new editorial #zaracollection",138,64000,product interaction album cover girl pattern smile
9,"roll with it | volume, energy, attitude. a special collection for special nights.",493,54800,eyewear black and white vision care sunglasses glasses monochrome photography cool gentleman monochrome health & beauty
11,"roll with it collection | an attitude that's real & undiluted, instantly recognizable and always individual. stepped up tempos and loud guitars mixed with the spirit of 70s cool #collection",247,62900,formal wear suit blazer outerwear button tuxedo jacket sleeve collar neck
12,the hoodie sweater | new knit trends forseasonseason,267,100800,fashion model coat black and white fashion shoulder overcoat outerwear joint gentleman neck
13,meet the fringedclothing | new editorial presenting knit trends #collection,317,115200,fur shoulder long hair animal product
14,time for knit trends | the ribbed look: sweater + clothing. new editorial. thank you @andreeadiddy #collection,143,69300,standing fashion model black and white shoulder joint outerwear coat pattern costume gentleman
15,comfy | girls editorial. simple and cozy. check knotclothing and ribbed leggings,136,66100,clothing tartan sleeve shoulder pattern outerwear plaid design sweater arm
16,comfy | girls editorial. simple and cozy. check bow clothing & grey cardigan,153,80200,furniture sitting shoulder product design chair shoe joint couch cushion human leg
17,comfy | girl editorial. simple and cozy garments. special collection.,396,230200,beauty shoulder hairstyle portrait neck forehead photo shoot black hair human girl
18,midtown warm-up | new woman editorial now available. thank you @myrthebolt_,520,189600,shoulder snapshot fashion outerwear socialite fur joint road street shoe
19,midtown warm-up | seasonal teddy-texture mixed with nostalgic floral print midi clothinges.,200,80900,black and white t shirt monochrome photography photography fashion sleeve design pattern monochrome product
20,"mid-town warm up | a story inspired by a modern take on retro classics based on textures of shearlingclothings, teddy texture patterned tights & kitten heels. thank yoy @cara_taylorrr #collection",195,93400,pink purple magenta fashion jeans shoe trousers
21,this is #collection | palazzoclothing 8473/802,257,53200,clothing text product standing font product design joint pattern product pattern
23,this is #collection | cashmere roll neck sweater 6873/176,158,53600,clothing outerwear font neck pattern pattern brand sleeve
27,"join life | natural farmingecologically grown cotton is farmed using natural fertilizers or pesticides. this process is water-friendly and reduces the co2 emissions, helping us to prevent the climate change.",418,190600,mammal rabits and hares rabbit child toddler ear product beige fur girl
28,"join life | organic cottonorganically or ecologically grown cotton is farmed in a way that respects the environment, biodiversity and the people who farm it.",312,151800,shoulder sitting child product toddler textile leg joint cat flooring
29,"join life | baby girl sustainable collection.under the label #collection, we categorise all garments that have been produced using the best sustainable processes and raw materials",207,117900,nose cheek child neck toddler lip product ear
30,lights galore |collection editorial. thank you @marjanjonkman,412,84300,fashion accessory joint shoe leg tights costume thigh tartan punk fashion
32,lights galore icollection editorial. thank you @marjanjonkman,157,77200,purple textile outerwear magenta long hair girl
33,a forest ride | kids editorial,365,229400,clothing outerwear shoe fur jeans trousers neck
34,a forest ride | editorial for kids,233,150100,boats and boating equipment and supplies water boat leisure oar vacation recreation boating plant community
35,a forest ride | new editorial for kids,524,210500,clothing white snapshot outerwear jeans denim trousers product shoe sleeve
36,smooth textures | woman editorial. thank you @ediebcampbell,226,100500,fashion model black and white model joint fashion monochrome photography photo shoot gentleman outerwear tights
37,smooth textures | woman editorial. thank you @ediebcampbell,234,90500,purple violet fashion model outerwear model velvet costume magenta pattern
39,"a mix of wools, shape and proportion | man editorialseason tones. thank you @iohma",133,64900,plaid tartan pattern sleeve outerwear design jacket dress shirt denim headgear
41,contemporary classics inseasonal tones | man editorial. thank you @iohma,148,68400,shoulder outerwear fashion jacket top
42,mini capsule collection,714,212400,toddler child neck
43,mini capsule collection,"1,383",353900,nose toddler child infant neck product smile
44,mini capsule collection,780,286700,shoulder neck joint
45,collection pufferclothing collection,207,70000,fashion accessory shoulder outerwear fashion photo shoot girl model electric blue neck
46,the new puffers are here!,543,120200,yellow hood fur fur clothing jacket
47,join the puffy trend! newcollection editorial,149,75700,fur clothing fur coat fashion model neck collar
51,woman studio collection | coming soon #collection @kirindejonckheere @amandagooge,191,82800,formal wear suit fashion model little black dress dress fashion shoulder gentleman outerwear tuxedo
52,woman studio collection | coming soon #collection @kirindejonckheere,468,107400,woolen neck sweater fur clothing sleeve outerwear cardigan fur wool beige
53,woman studio collection | coming soon #collection @lex.herl @amandagooge,186,90100,suit formal wear tuxedo blazer fashion model shoulder gentleman outerwear fashion coat
55,this is #collection | red checkedclothing,208,74800,outerwear cardigan coat overcoat woolen jacket fashion model neck sleeve sweater
60,trick or treat? the masks | new editorial for kids,242,89800,eyebrow forehead chin cheek lip brown hair ear girl
61,in the mood of halloween? the masks | new editorial for kids,211,133700,human hair color blond outerwear long hair hair coloring girl brown hair neck portrait portrait photography
62,booo! the masks | new kids editorial,113,63000,facial expression t shirt boy smile chin plaid forehead tartan outerwear cheek
63,"dear india, discover & shop the weekly new-in now at zara.com. #dearindiathank you @urvashi_umrao photographed by @thebadlydrawnboy",122,69100,photograph black and white monochrome photography photography photo shoot monochrome girl gentleman stock photography model
64,"dear india, shop the latestseason collection now online.#dearindiathank you @nsfwsaket & @nitigyasingh photographed by @thebadlydrawnboy",132,54700,photograph black and white monochrome photography photography gentleman interaction monochrome stock photography film noir
65,"dear india, shop online is now available. thank you @urvashi_umrao photographed by @thebadlydrawnboy",236,45100,black and white photography monochrome photography album cover fashion monochrome font brand model photo shoot
66,iconic blazers | the checkedclothing 8303/610,263,123100,coat black and white fashion model gentleman fashion monochrome photography outerwear overcoat formal wear monochrome
67,iconic blazers | contrasting faux fur blazer 4391/221,174,78700,fur clothing black and white fashion model fur shoulder fashion outerwear neck monochrome photography stole
68,iconic blazers | pink wool blazer ref 8027/813 thank you @kdhwillems,270,116600,coat jacket fashion model blazer outerwear top supermodel
69,pearly beret 3920/244,474,141600,headgear black and white hat cap monochrome photography knit cap neck monochrome pattern beanie
71,textured neckerchief with ribbon and faux pearls 0247/249,152,88300,denim sleeve jacket outerwear fashion model neck pattern button model collar
75,"good times | featuring prints, velvet and satin. special suits for special events. and party! thank you @brodiescottt",226,78300,footwear sitting shoe shoulder
77,"clothing up and let_s groove. good times, new editorial for man. thank you @oliverkumbi",190,64500,suit outerwear gentleman formal wear blazer
78,this is a collaboration with eight families from different countries worldwide. each family has shared with us some pictures of their kid while they were wearing pajamas | life is better in pyjamas,335,82500,shoulder outerwear joint girl product child mother daughter
79,is there anything better than a sleeping child? this is a collaboration with eight families from different countries worldwide. each family has shared with us some pictures of their kids while they were wearing pyjamas.,198,89100,photograph product textile bed sleep material infant comfort child
80,life is better in pyjamas | this is a collaboration with eight families from different countries worldwide. each family has shared with us some pictures of their kids while they were wearing pyjamas.,770,209400,fur toddler wool product teddy bear child
81,retro fiction | polished and sophisticated looks with standard patterns,283,72100,plaid blazer tartan suit outerwear gentleman jacket formal wear design pattern
84,next destination: the west | an approach to the classic mood of rodeo.collection,158,77800,fashion accessory shoulder outerwear girl photo shoot neck pattern
85,"go rodeo | thiscollection editorial is a mix of blouses and clothinges in plaids and florals, heavyclothing,clothing, wideclothing and midi clothings.",118,74300,photograph black and white standing monochrome photography snapshot gentleman outerwear vintage clothing monochrome stock photography
86,let_s rock the western trend | go rodeo! newcollection editorial. thank you @kirindejonckheere & @ansolet_rossouw,225,71900,pink shoulder magenta outerwear product fashion girl textile t shirt
87,neutrals. style notes. updated outerwear | wear your classicclothing over yourclothingclothing. thank you @davidtrulik,218,65100,coat overcoat trench coat gentleman woolen fashion model beige formal wear
89,"neutrals, style notes | combine your twill suitclothing with your suedeclothing for a cool and contemporary aesthetic. thank you @davidtrulik",275,74700,outerwear jacket fashion model suit blazer beige collar coat gentleman sleeve
90,checkedclothings never get old | urban beats. new editorial,120,79300,photograph black and white monochrome photography photography snapshot monochrome pattern stock photography
91,"the quiltedclothing | high neck, long sleeves, front piped pockets, metal eyelet detail with contrasting ribbons and contrasting lining. urban beats | new editorial",208,101700,clothing outerwear pattern coat denim costume
92,short faux leatherclothing + shiny checkedclothing + faux leather mini clothing | it's urban beats! thank you @jean_campbell,138,91700,black and white model fashion model monochrome photography photo shoot photography shoulder top monochrome long hair
93,season vibes | new baby editorial,908,238600,clothing shoulder outerwear sleeve jeans pattern joint girl trousers pattern
94,dungaree and cosy baggyclothing |season vibes. baby editorial,434,145300,wheelbarrow vehicle cart toddler play child grass product plant table
95,brothers and sisters inseason vibes. new baby editorial,677,219100,child sitting toddler outerwear textile girl sleeve product material pattern
102,urban and cosy |season vibes in new boy capsule collection,141,83800,mammal soil dog like mammal tree grass
103,cosy boy capsule collection | marble print sweatclothing collection,218,114300,shoulder outerwear neck human behavior girl portrait photography
104,walking the dog | boy capsule collection now available,176,101300,dog jacket dog like mammal outerwear jeans sweater textile sleeve snout neck
105,"this isclothing. a vary of washes, tones, shapes and styles allow it to be completely accesible whilst continually being renewed . thank you @samuel_worthen",307,103800,denim outerwear jeans fashion formal wear sleeve jacket shoe suit
106,this isclothing | you_ll never have enough ofclothing | new man editorial,146,68900,photograph person man black and white gentleman model male monochrome photography photography chin
107,a classic wardrobe mainstay for over 50 years and still more relevant than ever.clothing is still a staple for both the stylish & relaxed clothinger. thank you @andreassandby,192,83900,denim sitting jeans shoe trousers photo shoot model furniture
108,playing outdoors | baby boy capsule collection,307,136000,child outerwear girl boy product toddler smile portrait photography
109,baby boy capsule collection. in the great nature,255,105100,t shirt outerwear neck sleeve product cool cap brand
110,let's go into the forest! baby boy capsule collection,148,112400,tree plant grass forest jungle girl
111,floral prints meet plain colors in new woman editorial | 70's mood,234,92700,clothing fashion model dress neck velvet day dress sleeve magenta model pattern
112,contemporary approach to 70's floral patterns | new woman editorial now available,149,81200,outerwear shoulder photo shoot neck model girl pattern
113,throwback thursday | it's 70's inspired! woman editorial. thank you @giedre.dukauskaite,220,101400,yellow shoulder outerwear textile neck pattern photo shoot sleeve
117,"l.a.,1958. croppedclothing, leatherclothings and white t-clothings: a uniform. man editorial | the pieces.",166,62100,black and white gentleman fashion model photography fashion jacket model monochrome photography outerwear monochrome
119,"rome, 1962. sharp tailoring, modern silhouettes with a keen focus on detail and prints. new man editorial | the pieces",197,95200,black and white model photography fashion model monochrome photography shoulder fashion outerwear photo shoot gentleman
120,the best match onclothing is moreclothing |collection editorial,213,78200,photograph black and white sitting beauty standing model photography monochrome photography photo shoot shoulder
122,meet #clothing with @londonemyers in newcollection editorial. now available,166,66800,headgear fashion accessory cap cool beanie hat denim
123,"hey kids, let's go back to school | new editorial now available",168,89600,photograph facial expression black and white plaid photography sleeve smile boy monochrome photography outerwear
125,it's time to go back to school! the new editorial for kids is now available,146,95500,photograph facial expression black and white photography monochrome photography smile shoulder photo shoot girl monochrome
129,the trench edit | several different ways to wear a trench. the punky look,220,68500,clothing fashion model shoulder supermodel jeans outerwear waist model trousers abdomen
130,the trench edit | several different ways to wear a trench. the casual look. thank you @juliehoomans,130,73900,sitting fashion model jeans denim shoe trousers
131,the trench edit | from the casual to the feminine chic look. several different ways to wear a trench. thank you @marjanjonkman,212,68400,gentleman fashion outerwear costume formal wear
134,september is coming | back to work. monday-to-friday keys forseasonseason 2017 #editorial #collection thank you @riannevanrompaey,242,105400,black photograph sitting black and white model beauty fashion model photo shoot shoulder photography
135,join life man sustainable editorial #season | renewable energies or reusing resources like water can help us produce garments in an eco-efficient way #collection #collection #editorial,182,75000,photograph black and white monochrome photography headgear gentleman photography cap male fedora cool
136,join life man sustainable editorial #season | the combination of recycled materials and raw materials such us organic cotton or tencelî helps us to reduce our impact and take care of the environment #collection #collection #editorial,115,50000,gentleman outerwear eyewear fashion sleeve suit cool vision care album cover blazer
137,join life man sustainable editorial #season | processes and materials that help us to take care of the environment #collection #collection #editorial thank you @frederikruegger,148,61800,fashion suit outerwear shoe formal wear gentleman coat fashion design jeans model
138,uclothingia | key trends forseasonseason 2017. woman editorial #editorial #collection thank you @selenaforrest,183,60400,clothing yellow outerwear coat formal wear robe
139,uclothingia | key trends forseasonseason 2017. woman editorial #editorial #collection thank you @selenaforrest,191,69400,outerwear shoulder pattern long hair product pattern
140,uclothingia | key trends forseasonseason 2017. woman editorial #editorial #collection thank you @selenaforrest,205,83800,yellow fashion model shoulder sleeve photo shoot neck beige
141,"the new flamboyant | nomad, new woman editorial #collection #editorial",401,77700,purple fashion outerwear costume tradition socialite costume design formal wear fashion design pattern
143,opulent textures in the new woman editorial | nomad is now available online and in-stores #collection #editorial,209,89200,fashion costume design pattern fashion design
144,good vibes only | baby girl capsule collection #collection,538,164500,photograph yellow human hair color photography standing child girl outerwear blond human behavior
145,cozy jumpsuit for funny afternoons | baby girl capsule collection #collection,294,125300,sitting sleeve child photography outerwear boy sweater toddler child model t shirt
146,it_s fun outside | new baby girl capsule collection #collection #editorial,244,117600,beauty human hair color girl smile shoulder fashion accessory headgear neck outerwear cool
147,discover the newcollection editorial | mixed textures. thank you @michelle_gtk #zaracollection #editorial,221,101700,girl stock photography
149,let_s play with mixed texture | newcollection editorial #zaracollection thank you @manuela_sanchez__,152,65800,girl portrait photo shoot brown hair model
150,find your seat and get ready for the movie to start. all eyes on the big screen! #collection,269,106600,red clothing outerwear girl shoulder fashion textile product jacket long hair
151,"buy your tickets for a movie, and don_t forget your popcorn | girls editorial #collection",171,99400,shoulder outerwear textile girl product pattern smile beige
152,call your friends and meet them at the cinema | new editorial for girls #collection,167,87900,eyewear red vision care glasses sunglasses cool girl square magenta smile
153,outerwear | 3. the blazer 8033/693 thank you @ezrapetronio,282,61700,formal wear suit blazer shoulder outerwear tuxedo neck magenta jacket
155,outerwear | 1. the trench 0518/055 thank you @ezrapetronio,138,71900,gentleman forehead necktie outerwear neck white collar worker portrait formal wear professional beige
156,"shape the invisible is a collaboration between zara and new talents emerging from some of the most important design schools. with recycling as the initial idea, zara gave the schools clothing from previous seasons, with which the students then created new garments adding their own design and vision. learn more at zara.com #shapetheinvisible",254,60500,font product design collection light fixture
157,"shape the invisible is a collaboration between zara and new talents emerging from some of the most important design schools. with recycling as the initial idea, zara gave the schools clothing from previous seasons, with which the students then created new garments adding their own design and vision. learn more at zara.com #shapetheinvisible",121,52600,lighting font product design light fixture
158,"shape the invisible is a collaboration between zara and new talents emerging from some of the most important design schools. with recycling as the initial idea, zara gave the schools clothing from previous seasons, with which the students then created new garments adding their own design and vision. learn more at zara.com #shapetheinvisible",81,43500,light fixture product lighting font product design lamp brand
159,the minimalist edit | mandarin collarclothing 0071/296 + chinoclothing 2318/320 available online and selected stores #collection,149,66800,shoulder outerwear suit formal wear
160,the minimalist edit | solid coloredclothing 1564/320 + solid coloredclothing 0070/296 + basic bermuda shorts 0706/398 + white sneakers with straps 5416/202 available online and selected stores #collection,167,66100,shoe fashion model gentleman fashion outerwear sleeve shorts trousers neck
161,the minimalist edit | checked sweater 4566/300 + cropped chinoclothing 2318/322 + matte black leatherclothing 5027/202 available online and in selected stores #collection,236,72700,khaki waist joint trousers beige active pants shoe human leg abdomen pocket
162,soft and jumpsuits | girls capsule collection #collection #season,327,110300,fashion model shoulder supermodel leg thigh model joint photo shoot lingerie tights
164,soft and flowers | girls capsule collection now available #collection #aw7,275,131600,clothing dress outerwear day dress design nightwear pattern pattern sleeve robe
168,stripedclothing with bows #collection #collection #season ref 7724/990 picture by @ezrapetronio,204,95900,clothing shoulder purple sleeve neck outerwear blouse top pattern
169,the stripes | #collection long assymetric tunic ref 7778/617 #season #collection picture by @ezrapetronio,155,72500,shoulder model fashion model photo shoot brown hair neck
170,this is #collection | printed t-clothing ref 5580/210 #collection #season picture by @ezrapetronio,107,67400,t shirt forehead black hair product brown hair neck long hair hair coloring
171,the tweed | #collection #clothing ref 7772/603 #collection picture by @ezrapetronio,103,55400,headgear neck hair accessory hat
172,this is #collection | long assymetric tunic ref 7778/617 #season #collection picture by @ezrapetronio,93,65400,red product outerwear textile pattern clothes hanger pattern
173,suit but casual | this is #collection #softclothing ref 2753/222 #clothing 7901/222 #season picture by @ezrapetronio,162,87700,clothing yellow eyewear outerwear fashion model vision care blazer coat top button
174,seasonseason 2017 kids campaign by @matteomontanariphotography art direction @ezrapetronio #collection #collection #season,269,75900,plaid tartan outerwear pattern shoulder jacket design product sleeve neck
176,seasonseason 2017 campaign by willy vanderperre #collection #collection #season,214,57400,fashion model fashion formal wear gentleman suit shoe runway blazer model fashion design
178,fallseason 2017 campaign by @stevenmeisel_ art direction by @fabienbaron stylist karl templer #collection #collection #season,294,73800,black and white beauty monochrome photography photography fashion accessory headgear gentleman fashion monochrome model
183,city lights | pre-fall #season. embrace the lights of the city,312,94400,dress outerwear fashion costume pattern pattern fashion design
184,city lights | discover our bright pre-fall collection now online and in stores #season,228,68400,footwear shoe dress fashion outerwear pattern design tartan fashion design pattern
186,join life | baby girl sustainable collection. tencelî is derived from wood grown in sustainable forests that guarantee their reforestation #collection,705,170200,clothing pink shoulder dress textile product child girl nightwear toddler
187,"join life | baby girl sustainable collection. organic cotton is grown using practices that help us to protect biodiversity, such as the use of natural fertilizers #collection",141,95900,sitting child child model toddler photo shoot girl portrait photography
188,join life | baby girl sustainable collection. a selection of the best sustainable raw materials and processes that helps us to take care of the environment #collection,376,141600,clothing shoulder sleeve joint child neck beige abdomen waist trousers
189,pink | fringe earrings #collection #season ref 4548/204,236,75200,chin eyebrow cheek forehead neck black hair human wig lip hair coloring
191,the look | fringe earrings for a touch of color #collection ref 4319/203 #season,228,92800,eyebrow chin lip cheek forehead neck black hair wig brown hair ear
192,this is #collection | doclothing #clothing ref 6855/019 and #clothing ref 6855/016 #zaracollection #season,254,72400,photograph black and white photo shoot photography monochrome photography fashion model headgear model shoe fashion
